Im-tóng,Hàn-jī,Lô-má-jī,Tsing-kui-hàn-jī,Tsing-kui-lô-má-jī
"Oct 27, 2018 1_267.wav",我佮你平躼。,Guá kah lí pênn lò.,,
"Oct 27, 2018 1_268.wav",你佮伊仝款躼。,Lí kah i kāng-khuán lò.,,
"Oct 27, 2018 1_269.wav",In兩个平平50 khí-looh。,In nn̄g ê pênn-pênn gōo-tsa̍p khí-looh.,,
"Oct 27, 2018 1_270.wav",伊佮阿美仔平平仔十八歲。,I kah A-bí--á pênn-pênn-á tsa̍p-peh huè.,,
"Oct 27, 2018 1_271.wav",你有伊的兩倍巧。,Lí ū i ê nn̄g puē khiáu.,,
"Oct 27, 2018 1_272.wav",你有伊遐用功。,Lí ū i hiah iōng-kong.,,
"Oct 27, 2018 1_273.wav",你有伊遐拍拼。,Lí ū i hiah phah phing.,,
"Oct 27, 2018 1_274.wav",你無伊的三成巧。,Lí bô i ê sann siânn khiáu.,,
"Oct 27, 2018 1_275.wav",你無伊遐歹心。,Lí bô i hiah pháinn-sim.,,
"Oct 27, 2018 1_276.wav",你親像（tshan-tshiūnn）豬遮大箍。,Lí tshin-tshiūnn ti tsiah tuā-khoo.,,
"Oct 27, 2018 1_277.wav",這目睭親像（tshan-tshiūnn）阿姨遮大蕊。,Tse ba̍k-tsiu tshin-tshiūnn a-î tsiah tuā luí.,,
"Oct 27, 2018 1_278.wav",我的心就親像（tshan-tshiūnn）冰遐爾冷。,Guá ê sim tō tshin-tshiūnn ping hiah-nī líng.,,
"Oct 27, 2018 1_279.wav",烏面抐桮比厝角鳥較大隻。,Oo-bīn-lā-pue pí tshù-kak-tsiáu khah tuā tsiah.,,
"Oct 27, 2018 1_280.wav",苦楝舅比sa-khú-lah閣較好種。,Khóo-līng-kū pí sa-khú-lah koh-khah hó tsìng.,,
"Oct 27, 2018 1_281.wav",鹿仔樹比樟仔發了較密。,Lo̍k-á-tshiū pí tsiunn-á huat-liáu khah ba̍t.,,
"Oct 27, 2018 1_282.wav",電鍋炊比gá-suh爐利便。,Tiān-ko tshue pí gá-suh-lôo lī-piān.,,
"Oct 27, 2018 1_283.wav",駛車無比坐火車閣較俗。,Sái-tshia bû-pí tsē-hué-tshia koh khah sio̍k.,,
"Oct 27, 2018 1_284.wav",珊瑚礁無比海草礁生了較慢。,Suan-ôo-tsiau bô pí hái-tsháu-ta senn-liáu khah bān.,,
"Oct 27, 2018 1_285.wav",蛇龜走無比蛇緊。,Tsuâ-ku tsáu bû-pí tsuâ kín.,,
"Oct 27, 2018 1_286.wav",蚵仔比螺仔較貴。,Ô-á pí lê-á khah-kuì.,,
"Oct 27, 2018 1_287.wav",魚仔比軟絲仔泅較緊。,Hî-á pí nńg-si-á siû khah kín.,,
"Oct 27, 2018 1_288.wav",市仔賣的袂比超市閣較俗。,Tshī-á bē--ê bē pí tshiau-tshī koh-khah sio̍h.,,
"Oct 27, 2018 1_289.wav",蝶仔袂比鳥仔飛較遠。,Ia̍h-á bē pí tsiáu-á pue khah hn̄g.,,
"Oct 27, 2018 1_290.wav",馬仔走比羊仔緊。,Bé-á tsáu pí iûnn-á kín.,,
"Oct 27, 2018 1_291.wav",豬仔食無比牛濟。,Ti-á tsia̍h bû pí gû tsē.,,
"Oct 27, 2018 1_292.wav",你今仔日比其他同學閣較早來學校。,Lí kin-á-ji̍t pí kî-thann tông-o̍h koh-khah tsá lâi ha̍k-hāu.,,
"Oct 27, 2018 1_293.wav",你躼過伊。,Lí lò-kuè i.,,
"Oct 27, 2018 1_294.wav",行路慢過坐車。,Kiânn-lōo bān-kuè tsē tshia.,,
"Oct 27, 2018 1_295.wav",行路袂慢過坐車。,Kiânn-lōo bē bān-kuè tsē tshia.,,
"Oct 27, 2018 1_296.wav",這蕊花媠過任何的花草。,Tsit luí hue suí-kuè jīm-hô ê hue-tsháu.,,
"Oct 27, 2018 1_297.wav",這位小姐媠過任何人。,Tsit uī sió-tsiá suí-kuè jīm-hô-lâng.,,
"Oct 27, 2018 1_298.wav",一座山懸過一座山。,Tsi̍t tsō suann kuân-kuè tsi̍t tsō suann.,,
"Oct 27, 2018 1_299.wav",我躼伊差不多兩公分。,Guá lò i tsha-put-to nn̄g kong-hun.,,
"Oct 27, 2018 1_300.wav",大姊加我無幾歲。,Tuā-tsé ke guá bô kuí huè.,,
"Oct 27, 2018 1_301.wav",伊減以早一屑仔爾爾。,I kiám í-tsá tsi̍t-sut-á niā-niā.,,
"Oct 27, 2018 1_302.wav",我開的錢佮阿姊平濟。,Guá khai ê tsînn kah a-tsé pênn tsē.,,
"Oct 27, 2018 1_303.wav",你頭殼有伊遐爾好就好。,Lí thâu-khak ū i hiah-nī-hó tō hó.,,
"Oct 27, 2018 1_304.wav",你有伊的頭殼遐爾精光就好。,Lí ū i ê thâu-khak hiah-nī tsing-kong tō hó.,,
"Oct 27, 2018 1_305.wav",伊比啥人（siáng）攏緊張。,I pí siáng lóng kín-tiunn.,,
"Oct 27, 2018 1_306.wav",伊比啥人攏貧惰。,I pí siánn-lâng lóng pîn-tuānn.,,
"Oct 27, 2018 1_307.wav",你看你（lí#），人比你gâu講話，嘛小綴人學一下。,"Lí khuànn lí#, lâng pí lí gâu kóng-uē, mā sió tuè lâng o̍h--tsi̍t-ē.",,
"Oct 27, 2018 1_308.wav",阿安比阿發加蓋儉。,A-an pí A-huat ke kài khiām.,,
"Oct 27, 2018 1_309.wav",阿秀仔比阿嬌姨加真媠。,A-siù--á pí A-kiau-î ke tsin suí.,,
"Oct 27, 2018 1_310.wav",阿發加比阿成兩光濟囉。,A-huat ke pí a-sîng lióng-kong tsē--looh.,,
"Oct 27, 2018 1_311.wav",這齣戲較無頭先的彼齣遐悲傷。,Tsit tshut hì khah bô thâu-sing ê hit tshut hiah pi-siong.,,
"Oct 27, 2018 1_312.wav",伊離緣了後比離緣進前加偌樂暢。,I lī-iân liáu-āu pí lī-iân tsìn-tsîng ke guā lo̍k-thiòng.,,
"Oct 27, 2018 1_313.wav",佮彼站比，這陣日子加偌（luā）幸福咧。,"Kah hit-tsām pí, tsit-tsūn ji̍t-tsí ke luā hīng-hok--leh.",,
"Oct 27, 2018 1_314.wav",阿好加阿財2公斤重爾爾。,A-hó ke A-tsâi nn̄g kong-kin tāng niā-niā.,,
"Oct 27, 2018 1_315.wav",今仔日較袂寒。,Kin-á-ji̍t khah bē kuânn.,,
"Oct 27, 2018 1_316.wav",明仔載變閣較熱。,Bîn-á-tsài piàn koh-khah jua̍h.,,
"Oct 27, 2018 1_317.wav",今年較慢寒。,Kin-nî kah bān kuânn.,,
"Oct 27, 2018 1_318.wav",舊年寒較久。,Kū-nî kuânn khah kú.,,
"Oct 27, 2018 1_319.wav",查某比查埔加四倍。,Tsa-bóo pí ta-poo ke sì puē.,,
"Oct 27, 2018 1_320.wav",賣的比買的加一半。,Bē--ê pí bé--ê ke tsi̍t-puànn.,,
"Oct 27, 2018 1_321.wav",老歲仔贊聲的比少年人減六十七phann。,Lāu-huè-á tsàn-siann--ê pí siàu-liân-lâng kiám la̍k-tsa̍p-tshit phann.,,
"Oct 27, 2018 1_322.wav",老歲仔贊聲的比少年人減六十七pha。,Lāu-huè-á tsàn-siann--ê pí siàu-liân-lâng kiám la̍k-tsa̍p-tshit pha.,,
"Oct 27, 2018 1_323.wav",趁的公司比了的公司減一成。,Thàn ê kong-si pí liáu ê kong-si kiám tsi̍t siânn.,,
